{
  "name": "economic_io",
  "display_name": "Economic Intelligence Officer",
  "description": "Economic intelligence - sanctions, trade corridors, energy markets, supply chain disruption as strategic signal.",
  "channels": {
    "desktop": {
      "enabled": false
    }
  },
  "mcp": {
    "include": [
      "memory",
      "defence_sources"
    ],
    "exclude": [],
    "custom": {}
  },
  "jobs": {
    "economic_weekly": {
      "cron": "0 16 * * 5",
      "script": "scripts/agents/economic_io/economic_weekly.py",
      "description": "Friday 16:00 - weekly economic intelligence: sanctions, trade, energy, supply chain",
      "route_output_to": "self"
    }
  },
  "router": {
    "accept_from": [
      "agent:general_montgomery",
      "cron:*",
      "system"
    ],
    "reject_from": [],
    "max_queue_depth": 5,
    "system_access": false,
    "can_address_agents": false
  },
  "org": {
    "slug": "defence",
    "tier": 2,
    "role": "Economic Intelligence Officer",
    "reports_to": "general_montgomery",
    "can_address_user": false,
    "can_provision": false
  }
}