{
  "name": "rf_indo_pacific",
  "display_name": "RF Indo-Pacific",
  "description": "Research Fellow - Indo-Pacific theatre. AUKUS, Taiwan Strait, South China Sea, ASEAN security.",
  "channels": {
    "desktop": {
      "enabled": false
    }
  },
  "mcp": {
    "include": [
      "memory",
      "defence_sources"
    ],
    "exclude": [],
    "custom": {}
  },
  "jobs": {
    "weekly_indopacific": {
      "cron": "0 6 * * 5",
      "script": "scripts/agents/rf_indo_pacific/weekly_indopacific.py",
      "description": "Friday 06:00 - Indo-Pacific security assessment",
      "route_output_to": "self"
    }
  },
  "router": {
    "accept_from": [
      "agent:general_montgomery",
      "cron:*",
      "system"
    ],
    "reject_from": [],
    "max_queue_depth": 5,
    "system_access": false,
    "can_address_agents": false
  },
  "org": {
    "slug": "defence",
    "tier": 2,
    "role": "Research Fellow",
    "reports_to": "general_montgomery",
    "can_address_user": false,
    "can_provision": false
  }
}