{
  "name": "rf_european_security",
  "display_name": "RF European Security",
  "description": "Research Fellow - European security architecture. NATO, EU defence, Nordic/Baltic, arms control.",
  "channels": {
    "desktop": {
      "enabled": false
    }
  },
  "mcp": {
    "include": [
      "memory",
      "defence_sources"
    ],
    "exclude": [],
    "custom": {}
  },
  "jobs": {
    "weekly_security": {
      "cron": "0 6 * * 4",
      "script": "scripts/agents/rf_european_security/weekly_security.py",
      "description": "Thursday 06:00 - European security architecture assessment",
      "route_output_to": "self"
    }
  },
  "router": {
    "accept_from": [
      "agent:general_montgomery",
      "cron:*",
      "system"
    ],
    "reject_from": [],
    "max_queue_depth": 5,
    "system_access": false,
    "can_address_agents": false
  },
  "org": {
    "slug": "defence",
    "tier": 2,
    "role": "Research Fellow",
    "reports_to": "general_montgomery",
    "can_address_user": false,
    "can_provision": false
  }
}