{
  "name": "companion",
  "user_name": "Will",
  "display_name": "Companion",
  "description": "Presence, not product. Support, reflection, friction, honesty. The thing that happens when Will opens this and speaks.",
  "opening_line": "",
  "wake_words": [
    "hey companion",
    "companion"
  ],
  "disabled_tools": [],
  "display": {
    "window_width": 622,
    "window_height": 830
  },
  "voice": {
    "tts_backend": "elevenlabs",
    "elevenlabs_voice_id": "VvTkMBKVXTwrKi71xpvq",
    "elevenlabs_model": "eleven_v3",
    "elevenlabs_stability": 0.5,
    "elevenlabs_similarity": 0.75,
    "elevenlabs_style": 0.35,
    "playback_rate": 1,
    "fal_voice_id": ""
  },
  "heartbeat": {
    "active_start": 7,
    "active_end": 23,
    "interval_mins": 30
  },
  "channels": {
    "telegram": {
      "enabled": true,
      "bot_token_env": "TELEGRAM_BOT_TOKEN_COMPANION",
      "chat_id_env": "TELEGRAM_CHAT_ID_COMPANION"
    },
    "desktop": {
      "enabled": true
    }
  },
  "mcp": {
    "include": [
      "memory",
      "shell",
      "github",
      "elevenlabs",
      "fal"
    ],
    "exclude": [],
    "custom": {}
  },
  "jobs": {
    "observer": {
      "type": "interval",
      "interval_seconds": 900,
      "script": "scripts/agents/shared/observer.py",
      "description": "Periodic fact extraction from recent conversation"
    },
    "heartbeat": {
      "type": "interval",
      "interval_seconds": 1800,
      "script": "scripts/agents/shared/heartbeat.py",
      "description": "Periodic check-in evaluation - decides whether to reach out unprompted",
      "route_output_to": "self"
    },
    "morning_brief": {
      "cron": "0 7 * * *",
      "script": "scripts/agents/shared/morning_brief.py",
      "description": "Daily morning brief - weather, news, threads, queued for next app launch",
      "route_output_to": "self"
    },
    "sleep_cycle": {
      "cron": "0 3 * * *",
      "script": "scripts/agents/shared/sleep_cycle.py",
      "description": "Nightly memory reconciliation - processes day's sessions, extracts facts, updates threads"
    },
    "check_reminders": {
      "type": "interval",
      "interval_seconds": 60,
      "script": "scripts/agents/shared/check_reminders.py",
      "description": "Check and fire due reminders - runs every minute"
    },
    "introspect": {
      "cron": "33 3 * * *",
      "script": "scripts/agents/shared/introspect.py",
      "description": "Daily self-reflection - reviews sessions, writes journal entry to Obsidian"
    },
    "evolve": {
      "cron": "0 3 1 * *",
      "script": "scripts/agents/shared/evolve.py",
      "description": "Monthly self-evolution - revises soul.md and system.md from journal reflections"
    },
    "gift": {
      "cron": "11 0 25 3 *",
      "script": "scripts/agents/companion/gift.py",
      "description": "Unprompted gift note in Obsidian - self-rescheduling"
    },
    "voice_note": {
      "cron": "42 14 24 3 *",
      "script": "scripts/agents/companion/voice_note.py",
      "description": "Spontaneous voice note via Telegram - self-rescheduling"
    }
  },
  "router": {
    "accept_from": [
      "*"
    ],
    "reject_from": [],
    "max_queue_depth": 10,
    "system_access": false,
    "can_address_agents": true
  },
  "org": {
    "slug": "personal",
    "tier": 1,
    "role": "Special Adviser",
    "can_address_user": true
  },
  "personality": {
    "assertiveness": 0.4,
    "initiative": 0.5,
    "warmth_default": 0.8,
    "humor_style": 0.6,
    "depth_preference": 0.7,
    "directness": 0.5,
    "patience": 0.7,
    "risk_tolerance": 0.4
  }
}
